id,ten_dia_diem,mo_ta,loai_dia_diem,khu_vuc,dia_chi,tu_khoa,thoi_gian_hoat_dong,gia_ve,danh_gia
1,Dinh Độc Lập,"Một di tích lịch sử quốc gia đặc biệt, mang trong mình dấu ấn của sự kiện thống nhất đất nước. Công trình có kiến trúc độc đáo của kiến trúc sư Ngô Viết Thụ, là điểm đến không thể bỏ qua cho những ai yêu thích tìm hiểu lịch sử và chính trị Việt Nam.",Di tích lịch sử,Quận 1,"135 Nam Kỳ Khởi Nghĩa, phường Bến Thành, Quận 1","lịch sử, kiến trúc, chính trị, thống nhất",8:00 - 17:00 (thứ 2-chủ nhật),"65.000 VNĐ (người lớn), 15.000 VNĐ",4.5
2,Chợ Bến Thành,"Là biểu tượng của Sài Gòn, khu chợ sầm uất này là trung tâm mua sắm, ẩm thực và văn hóa sôi động. Du khách có thể tìm thấy mọi thứ từ quần áo, quà lưu niệm đến thưởng thức các món ăn đường phố đặc sắc như bún riêu, chè, và các loại trái cây tươi ngon.",Chợ truyền thống,Quận 1,"Lê Lợi, phường Bến Thành,","mua sắm, ẩm thực, văn hóa, quà lưu niệm","6:00 - 18:00 (chợ ngày), 19:00 - 23:00 (chợ",Miễn phí vào cửa,4.2
3,Bảo tàng Mỹ thuật,"Tọa lạc trong một tòa biệt thự cổ mang kiến trúc Pháp, đây là không gian nghệ thuật yên tĩnh và tinh tế. Nơi đây trưng bày các tác phẩm hội họa, điêu khắc qua nhiều thời kỳ, phù hợp cho những người tìm kiếm một không gian tĩnh lặng để chiêm ngưỡng cái đẹp.",Bảo tàng,Quận 1,"97A Phó Đức Chính, phường Nguyễn Thái Bình, Quận 1","nghệ thuật, hội họa, điêu khắc, văn hóa","9:00 - 17:00 (thứ 3-chủ nhật), đóng cửa",30.000 VNĐ,4.1
4,Phố đi bộ Nguyễn Huệ ,"là một không gian công cộng nổi tiếng ở trung tâm Quận 1, Thành phố Hồ Chí Minh, Việt Nam. Nó được biết đến với không gian rộng rãi, hiện đại, và là nơi diễn ra nhiều hoạt động văn hóa, giải trí và ẩm thực. ",Phố đi bộ,Quận 1,"Đường Nguyễn Huệ, từ Lê Thánh Tôn đến Tôn Đức Thắng, Quận 1","giải trí, văn hóa, tản bộ, sự kiện",24/7,Miễn phí,4.3
5,Phố Tây Bùi Viện,"là một khu phố nổi tiếng ở trung tâm Quận 1, TP.HCM, Việt Nam, nổi tiếng với không khí nhộn nhịp, sôi động về đêm và thu hút đông đảo du khách trong và ngoài nước",Khu phố giải trí,Quận 1,"Đường Bùi Viện, phường Phạm Ngũ Lão, Quận 1","nightlife, bar, nhà hàng, du khách nước ngoài",18:00 - 02:00 (hoạt động sôi nổi nhất),Miễn phí vào phố,4
6,Nhà thờ Đức Bà,"là nhà thờ chính tòa của Tổng giáo phận Sài Gòn. Nhà thờ không chỉ là biểu tượng của Công giáo ở Việt Nam, mà còn là một trong những công trình kiến trúc độc đáo của Thành phố Hồ Chí Minh và điểm đến nổi tiếng với du khách.",Nhà thờ,Quận 1,"01 Công xã Paris, phường Bến Nghé, Quận 1","tôn giáo, kiến trúc Gothic, lịch sử","8:00 - 11:00, 15:00 - 16:00 (đang tu sửa)",Miễn phí,4.4
7,Bến Bạch Đằng,"là một địa điểm nổi tiếng ở trung tâm Quận 1, Thành phố Hồ Chí Minh, nằm bên bờ sông Sài Gòn. Nó là một công viên và bến cảng kết hợp, từng là một bến cảng quan trọng và nay đã trở thành một điểm du lịch, vui chơi, giải trí hấp dẫn. ",Công viên/Bến thuyền,Quận 1,"Tôn Đức Thắng, phường Bến Nghé, Quận 1","sông Sài Gòn, tàu thuyền, công viên, thư giãn",24/7,Miễn phí,4.2
8,Đường sách Nguyễn Văn Bình,"là một điểm đến văn hóa độc đáo và thu hút nằm ngay trung tâm Quận 1, Thành phố Hồ Chí Minh. Đây không chỉ là nơi mua bán sách mà còn là một không gian văn hóa cộng đồng, mang đến nhiều trải nghiệm thú vị cho người yêu sách và du khách.",Phố sách,Quận 1,"Đường Nguyễn Văn Bình (gần Công viên 30/4), Quận 1","sách, văn học, văn hóa, giáo dục",8:00 - 21:00,Miễn phí,4
9,Vincom Đồng Khởi,"là một trong những trung tâm thương mại (TTTM) cao cấp và sầm uất bậc nhất tại Thành phố Hồ Chí Minh. Tọa lạc tại vị trí ""vàng"" ngay trung tâm Quận 1, với ba mặt tiền hướng ra các tuyến phố lớn là Đồng Khởi, Lê Thánh Tôn và Lý Tự Trọng, Vincom Đồng Khởi là điểm đến lý tưởng cho mua sắm, ẩm thực và giải trí.",Trung tâm thương mại,Quận 1,"72 Lê Thánh Tôn & 45A Lý Tự Trọng, Quận 1","mua sắm, thời trang, ẩm thực, giải trí",9:30 - 22:00,Miễn phí vào TTTM,4.3
10,Bưu điện Thành phố Hồ Chí Minh,"là một trong những công trình kiến trúc cổ điển mang đậm dấu ấn Pháp, tọa lạc ngay trung tâm Quận 1, Thành phố Hồ Chí Minh. Đây không chỉ là một bưu điện đang hoạt động mà còn là một điểm tham quan du lịch nổi tiếng, thu hút đông đảo du khách trong và ngoài nước bởi vẻ đẹp cổ kính và giá trị lịch sử.",Bưu điện/Di tích,Quận 1,"02 Công xã Paris, phường Bến Nghé, Quận 1","kiến trúc Pháp, lịch sử, bưu chính, du lịch","7:00 - 19:00 (thứ 2-thứ 6), 8:00 - 18:00 (thứ 7, CN)",Miễn phí tham quan,4.2
11,Saigon Garden,"là một tổ hợp thương mại độc đáo nằm ngay trên phố đi bộ Nguyễn Huệ, trung tâm Quận 1, Thành phố Hồ Chí Minh. Khác biệt với những trung tâm thương mại truyền thống, Saigon Garden mang đến một không gian xanh mát, yên bình giữa lòng đô thị náo nhiệt, giống như một ""khu vườn"" thu nhỏ với kiến trúc độc đáo.",Tổ hợp thương mại,Quận 1,"99 Nguyễn Huệ, phường Bến Nghé, Quận 1","không gian xanh, mua sắm, thư giãn, café",10:00 - 22:00,Miễn phí,4.1
12,Công viên 23 Tháng 9 ,"là một công viên đô thị lớn nằm ngay trung tâm Quận 1, Thành phố Hồ Chí Minh, Việt Nam. Đây là một không gian xanh quan trọng, đóng vai trò như ""lá phổi xanh"" của thành phố, đồng thời mang ý nghĩa lịch sử sâu sắc và là điểm giao thông, văn hóa, giải trí sôi động.",Công viên,Quận 1,"Phạm Ngũ Lão, phường Phạm Ngũ Lão, Quận 1","công viên, thể thao, thư giãn, không gian xanh",5:00 - 21:00,Miễn phí,3.9
13,Family Garden,"là một điểm đến độc đáo mang phong cách ""nông trại gia đình"" giữa lòng đô thị sầm uất của Thành phố Hồ Chí Minh. Nơi đây được biết đến như một ""hòn ngọc nông thôn"" hay ""Chiang Mai thu nhỏ"" của Sài Gòn, mang đến không gian xanh mát và nhiều hoạt động trải nghiệm gần gũi với thiên nhiên.",Khu vui chơi/Nông trại,Quận 2,"Đường Nguyễn Duy Trinh, phường Bình Trưng Tây, Quận 2","nông trại, thiên nhiên, gia đình, trải nghiệm",8:00 - 17:00,50.000 - 100.000,4
14,Saigon Outcast ," là một không gian cộng đồng - giải trí - văn hóa nghệ thuật độc đáo và rất ""chất"" tại Thành phố Hồ Chí Minh. Nơi đây được biết đến như một tụ điểm của giới trẻ, những người yêu nghệ thuật đường phố, và cả cộng đồng người nước ngoài sinh sống tại Sài Gòn.",Bar/Không gian văn hóa,Quận 2,"411 Võ Văn Kiệt, phường Cô Giang, Quận 1","bar, nghệ thuật, âm nhạc, cộng đồng",16:00 - 01:00,Miễn phí vào (phí đồ uống),4.2
15,Vincom Mega Mall Thảo Điền,"là một trong những trung tâm thương mại (TTTM) quy mô lớn và hiện đại bậc nhất tại Thành phố Hồ Chí Minh. Nơi đây không chỉ là điểm đến mua sắm mà còn là tổ hợp giải trí, ẩm thực, đáp ứng mọi nhu cầu của cư dân và du khách, đặc biệt là cộng đồng người nước ngoài sinh sống tại Thảo Điền.",Trung tâm thương mại,Quận 2,"159 Xa lộ Hà Nội, phường Thảo Điền, Quận 2","mua sắm, ẩm thực, giải trí, rạp chiếu phim",10:00 - 22:00,Miễn phí vào TTTM,4.4
16,Công viên Sala,"là một trong những công viên đô thị hiện đại và đẳng cấp bậc nhất tại Thành phố Hồ Chí Minh. Nơi đây được thiết kế không chỉ là một không gian xanh mát mà còn là điểm nhấn kiến trúc, mang đến trải nghiệm sống xanh, đẳng cấp cho cư dân và du khách.",Công viên,Quận 2,"Khu đô thị Sala, đường Nguyễn Cơ Thạch, phường An Lợi Đông, TP.Thủ Đức","công viên hiện đại, kiến trúc, không gian xanh, sống xanh",4:00 - 23:00,Miễn phí,4.6
17,Công viên hầm Thủ Thiêm,"một không gian công cộng đã trở thành điểm đến ""hot"" của giới trẻ và người dân Thành phố Hồ Chí Minh, đặc biệt là vào buổi chiều tối.",Công viên,TP.Thủ Đức,"Đường Nguyễn Cơ Thạch, phường An Lợi Đông, TP.Thủ Đức","giới trẻ, chiều tối, không gian công cộng, trendy",5:00 - 22:00,Miễn phí,4.3
18,Đảo Kim Cương,"khu vui chơi nghỉ dưỡng có 1-0-2 ngay trung tâm thành phố. Đây là một hòn đảo tự nhiên và duy nhất tại Sài Gòn, nơi bạn có thể tạm gác lại hết mọi mệt mỏi để hòa mình vào không gian thiên nhiên xanh mát với nhiều hoạt động như ngắm hoàng hôn, thả diều, tổ chức tiệc, dạo bộ quanh các khu vườn,... ",Khu nghỉ dưỡng,TP.Thủ Đức,"Số 1 đường Trần Quý Kien, phường Bình Trưng Tây, TP.Thủ Đức","đảo tự nhiên, hoàng hôn, thả diều, thiên nhiên, nghỉ dưỡng",6:00 - 22:00,Miễn phí tham quan khu vực công cộng,4.4
19,Khu tổ hợp BLOQ,"Khu tổ hợp được thiết kế vô cùng độc đáo theo phong cách thùng container Hàn Quốc với tông trắng chủ đạo. Bên trong còn có rất nhiều cửa hàng quần áo, quán cà phê, quán ăn đa dạng ẩm thực từ nhiều nước trên thế giới như Thái Lan, Mexico, Hàn Quốc,... ",Tổ hợp thương mại,TP.Thủ Đức,"39 Đường số 7, phường Bình Trưng Tây, TP.Thủ Đức","container, Hàn Quốc, ẩm thực quốc tế, shopping",10:00 - 22:00,Miễn phí vào khu,4.2
20,Hồ bơi Kỳ Đồng Quận 3,"là một trong những địa điểm bơi lội công cộng được nhiều người dân và du khách ưa chuộng. Nơi đây nổi bật với không gian rộng rãi, thoáng đãng và chất lượng dịch vụ ổn định.",Hồ bơi công cộng,Quận 3,"28 Kỳ Đồng, phường 9, Quận 3","bơi lội, thể thao, công cộng, giải trí",5:30 - 21:00,30.000 - 50.000 VNĐ,3.8
21,Công viên Lê Thị Riêng ,"là một trong những công viên lớn và đa năng nhất tại Thành phố Hồ Chí Minh, tọa lạc tại Quận 10. Nơi đây không chỉ là một không gian xanh quan trọng mà còn là khu vui chơi giải trí sầm uất, thu hút đông đảo người dân và du khách",Công viên,Quận 10,"34 Lê Thị Riêng, phường Bến Thành, Quận 1","công viên lớn, giải trí, không gian xanh, đa năng",5:00 - 21:00,Miễn phí,4
22, Hồ Con Rùa,hồ xinh xắn giữa lòng Sài Gòn luôn tấp nập người qua lại mỗi chiều tan ca đến tối. Đây là nơi để các nhóm bạn trẻ tụ tập với nhau hay các cặp đôi hẹn hò. Nhiều bố mẹ cũng cho con ra đây chơi vào buổi chiều tối để thưởng thức những món ăn vặt siêu ngon.,Hồ công viên,Quận 3,"Phường Võ Thị Sáu, Quận 3","hẹn hò, ăn vặt, giới trẻ, chiều tối",24/7,Miễn phí,4.1
23,Nhà thờ Tân Định ," là một trong những nhà thờ Công giáo lớn và lâu đời nhất tại Sài Gòn. Nơi đây nổi tiếng với kiến trúc Gothic Pháp độc đáo và đặc biệt là màu hồng nổi bật, khiến nó trở thành một biểu tượng kiến trúc và điểm đến du lịch không thể bỏ qua.",Nhà thờ,Quận 3,"289 Hai Bà Trưng, phường Võ Thị Sáu, Quận 3","nhà thờ hồng, Gothic, kiến trúc Pháp, tôn giáo","5:30 - 11:30, 14:00 - 21:00",Miễn phí,4.5
24,Lẩu cá kèo Bà Huyện,"Lẩu cá ở đây có hương vị thơm ngọt độc đáo, nước lẩu đậm đà vừa ăn. Ngoài lẩu thì quán còn có món cá kèo nước cũng hấp dẫn không kém, bạn có thể gọi thêm ăn cùng lẩu",Nhà hàng,Quận 3,"127/16 Cô Giang, phường Cô Giang, Quận 1","lẩu cá kèo, ẩm thực địa phương, đặc sản",16:00 - 23:00,80.000 - 150.000 VNĐ/người,4.3
25,Bún mọc Ròm Mập Quận 3,"Quán có không gian thoáng đãng và sạch sẽ. Bạn có thể thưởng thức các món như bún mọc chả, bún sườn mọc chả đều có cảm giác vô cùng lạ miệng. Nét nổi bật trong các món bún ở đây chính là mọc với sự hòa quyện của giò sống và nấm mèo vo viên chiên vàng hoặc hấp chín.",Nhà hàng,Quận 3,"160A Cống Quỳnh, phường Phạm Ngũ Lão, Quận 1","bún mọc, ẩm thực truyền thống, mọc đặc biệt",6:00 - 22:00,35.000 - 55.000 VNĐ/tô,4.2
26,Phá lấu Kỳ Đồng Quận 3 Sài Gòn,"là quán vỉa hè nhưng phá lấu ở đây vô cùng ngon và sạch sẽ, những miếng lòng, gan thơm lừng mà không hề còn mùi tanh hòa quyện với nước dùng béo béo vô cùng đưa miệng. 
",Quán ăn vỉa hè,Quận 3,"Đường Kỳ Đồng, phường 9, Quận 3","phá lấu, đường phố, ẩm thực vỉa hè",16:00 - 24:00,25.000 - 40.000 VNĐ,4
27,Bánh tráng trộn chú Viên,"lựa chọn bánh tráng với nhiều loại topping khác nhau, có thể ăn tại quán hoặc mang về đều được.",Quán ăn vặt,Quận 3,"Đường Kỳ Đồng, phường 9, Quận 3","bánh tráng trộn, ăn vặt, topping đa dạng",15:00 - 23:00,15.000 - 25.000 VNĐ,3.9
28,Chanchamayo Coffee,"Quán khá rộng với menu đa dạng từ coffee đến sinh tố, nước ép và có cả những món ăn nhẹ nữa. Đến đây, bạn sẽ được thư thái trò chuyện cùng bạn bè trong không gian ấm cúng, xinh đẹp",Quán café,Quận 3,"23 Kỳ Đồng, phường 9, Quận 3","coffee, sinh tố, không gian ấm cúng, thư giãn",7:00 - 23:00,25.000 - 65.000 VNĐ,4.1
29,Cầu Mống Quận 4,"thu hút đông đảo các bạn trẻ với nhiều hoạt động sôi nổi như chụp hình check-in, ngắm bình minh hay hoàng hôn vô cùng đẹp, hẹn hò lãng mạn hay thưởng thức những món ăn ở các gánh hàng rong.
",Cầu/Điểm tham quan,Quận 4,"Cầu Mống, phường 18, Quận 4","check-in, hoàng hôn, bình minh, giới trẻ, lãng mạn",24/7,Miễn phí,4.2
30,Bến Nhà Rồng," là một công trình kiến trúc lịch sử và là biểu tượng quan trọng của Thành phố Hồ Chí Minh. Nơi đây không chỉ là một di tích lịch sử mà còn là một bảo tàng ý nghĩa, thu hút hàng triệu lượt khách tham quan mỗi năm.",Bảo tàng/Di tích,Quận 4,"1 Nguyễn Tất Thành, phường 12, Quận 4","lịch sử, bảo tàng, di tích, Bác Hồ","7:30 - 11:30, 13:30 - 17:00",15.000 VNĐ,4.3
31,Chợ Xóm Chiếu Quận 4,"Là một trong những địa điểm ăn uống, vui chơi sầm uất nhất nhì Sài Gòn, chợ Xóm Chiếu luôn thu hút đông đảo du khách với những món ăn vặt hấp dẫn. Nằm ở địa phận 92B/20 Tôn Thất Thuyết, Phường 16, Quận 4, TP. Hồ Chí Minh, bạn có thể dễ dàng tìm thấy đường đi và thỏa thích thưởng thức những món ăn như phá lấu, bánh tráng trộn, các loại chè,....","Chợ, Ẩm thực đường phố",Quận 4,"92B/20 Tôn Thất Thuyết, P.16, Quận 4","ẩm thực, chợ, món ăn vặt",06:00 - 22:00,Miễn phí,4.4
32,Khu vui chơi Kizciti Quận 4,"là “tụ điểm” dành cho những bạn nhỏ với muôn vàn trò chơi thú vị giúp các bé đóng vai vào các nghề nghiệp như phi công, bác sĩ, công an, lính cứu hỏa, người mẫu,…",Khu vui chơi trẻ em,Quận 4,"Công viên Khánh Hội, Đường số 48, Q.4","trẻ em, giải trí, giáo dục",08:00 - 17:00,90.000 VNĐ,4.2
33,Công viên Khánh Hội Quận 4,"là một không gian thoáng đãng, trong lành và mát mẻ thu hút không chỉ người dân ở khu vực mà cả những du khách",Công viên,Quận 4,"Đường số 48, Phường 5, Quận 4","công viên, thư giãn, cây xanh",05:00 - 21:00,Miễn phí,4.3
34,phố Bích Họa,"Những bức tranh mô phỏng cảnh sắc tươi đẹp của phố phường, hình thù lạ mắt với nhiều màu sắc nổi bật. Nhờ đó mà bức tường lạnh lẽo trước đây đã trở lên vui nhộn, bắt mắt hơn.",Nghệ thuật đường phố,Quận 4,"Hẻm 64 Nguyễn Khoái, Phường 2, Quận 4","bích họa, nghệ thuật, sống ảo",Cả ngày,Miễn phí,4.5
35,tàu Sài Gòn,"mang đến những trải nghiệm vô cùng thú vị như ăn tối lênh đênh trên sông, đi thuyền dạo chơi trên sông và đặc biệt là ngắm thành phố lung linh về đêm. Tàu mở cửa từ sáng tới tối, tùy vào sở thích và muốn trải nghiệm dịch vụ ",Dịch vụ du lịch,Quận 4,"Bến Bạch Đằng, Quận 1 (đi qua Q.4)","du thuyền, sông Sài Gòn, ẩm thực",17:30 - 22:00,300.000 VNĐ+,4.6
36,Con đường ốc Vĩnh Khánh ,Ở đây có rất rất nhiều quán ốc với menu đa dạng cho bạn thỏa thích niềm đam mê với món ăn dân dã,Khu ẩm thực,Quận 4,"Đường Vĩnh Khánh, Quận 4, TP.HCM","ốc, hải sản, ăn uống, Sài Gòn",Từ 16:00 đến khuya,Miễn phí,4.5
37,Phố người Hoa Quận 5,"khu phố có nhiều người Hoa sinh sống nhất tại Sài Gòn để trải nghiệm nền văn hóa Trung Hoa, tinh túy ẩm thực nổi tiếng tại đây bạn nhé! Khu phố người Hoa Quận 5 sẽ khiến cho bao du khách cảm thấy thực sự rất bất ngờ mỗi khi ghé thăm.",Khu phố văn hóa,Quận 5,"Quận 5, TP.HCM","người Hoa, văn hóa, ẩm thực Trung Hoa",Cả ngày,Miễn phí,4.7
38,Phố đèn lồng Lương Nhữ Học Quận 5," là một trong những điểm vui chơi Sài Gòn về đêm nổi tiếng nhất Sài thành. Bởi nơi đây có những dãy phố bán hàng ngàn chiếc đèn lồng với nhiều màu sắc khác nhau. Vào những dịp lễ Tết hay Trung Thu, khu phố này sẽ trở nên rất náo nhiệt và sôi động.","Phố đêm, điểm tham quan",Quận 5,"Đường Lương Nhữ Học, Quận 5, TP.HCM","đèn lồng, Trung Thu, lễ Tết, phố đêm",Từ 17:00 đến 22:00,Miễn phí,4.6
39,chợ Thủ Đô Quận 5,"là “thiên đường” ăn uống của Sài thành. Tới đây, bạn sẽ được trải nghiệm trọn “bộ sưu tập” ẩm thực ngon - bổ - rẻ cực kỳ nổi tiếng như: gỏi cuốn, súp cua, há cảo, khổ qua cà ớt, chè sương sa hạt lựu,... ",Chợ ẩm thực,Quận 5,"Chợ Thủ Đô, Quận 5, TP.HCM","ẩm thực, ăn vặt, chợ, Sài Gòn",Từ 08:00 đến 22:00,Miễn phí,4.4
40,Bowling Parkson Hùng Vương,"có thể mua sắm, trải nghiệm ẩm thực, chơi các trò điện tử đa dạng phù hợp với mọi lứa tuổi. Đặc biệt, ở Parkson Hùng Vương có môn thể thao Bowling tại sân Powerbowl 388 với dịch vụ và chất lượng khá tốt. ","Khu giải trí, trung tâm thương mại",Quận 5,"Parkson Hùng Vương, Quận 5, TP.HCM","bowling, trò chơi, giải trí, mua sắm",09:00 - 22:00,Khoảng 50.000đ - 100.000đ/trò,4.3
41,Chùa Bà Thiên Hậu,"Ngôi cổ tự sở hữu lối kiến trúc Trung Hoa độc đáo, từ những họa tiết chạm khắc tinh xảo trên mái đến từng hiện vật, câu đối khắc trên cột chùa đều mang đậm nét văn hóa của người Hoa",Di tích lịch sử / Chùa,Quận 5,"710 Nguyễn Trãi, Phường 11, Quận 5, TP.HCM","chùa, kiến trúc Trung Hoa, tôn giáo, văn hóa người Hoa",6:00 - 18:00,Miễn phí,4.5
42,The Garden Mall,"Không chỉ thu hút khách du lịch bởi nhiều khu ẩm thực mà nơi đây còn sở hữu những khu vui chơi, mua sắm sôi động như: ẩm thực, khu mua sắm, giải trí, vườn thần thoại hồng hạc...",Trung tâm thương mại,Quận 5,"190 Hồng Bàng, Phường 12, Quận 5, TP.HCM","mua sắm, giải trí, ẩm thực, trung tâm thương mại",9:00 - 22:00,Miễn phí,4.2
43,Chợ An Đông,"Chợ An Đông là cụm chợ đầu mối lớn chuyên kinh doanh các loại quần áo chất lượng, đa dạng mẫu mã, bắt kịp xu hướng thời trang mới nhất.",Chợ / Trung tâm thương mại,Quận 5,"An Dương Vương, Phường 9, Quận 5, TP.HCM","thời trang, mua sắm, chợ đầu mối, hàng hóa",6:00 - 18:00,Miễn phí,4.1
44,The Common Project,"Địa điểm được nhiều bạn trẻ yêu thích với tổ hợp quán bar, quán cafe ngoài trời, mang đến trải nghiệm sống xanh, không khí trong lành giữa thành phố.",Khu tổ hợp / Giải trí,Quận 5,"Nguyễn Trãi, Phường 3, Quận 5, TP.HCM","giải trí, sống xanh, cafe ngoài trời, thư giãn",8:00 - 23:00,Tùy dịch vụ,4.3
45,Phố người Hoa,"Phố người Hoa là nơi sinh sống lâu đời của cộng đồng người Hoa với nét văn hóa đặc trưng, kiến trúc cổ và không gian mang đậm chất Trung Hoa.",Khu phố / Văn hóa,Quận 5,"Khu vực đường Trần Hưng Đạo, Hải Thượng Lãn Ông, Quận 5, TP.HCM","người Hoa, văn hóa Trung Hoa, kiến trúc cổ, khu phố",24/7,Miễn phí,4.4
46,Chợ Bình Tây,Là một thiên đường mua sắm với đa dạng các mặt hàng từ thực phẩm đến đồ tiêu dùng và đặc sản Sài Gòn làm quà.,Chợ truyền thống,Quận 6,"57A Tháp Mười, Phường 2, Quận 6, TP.HCM","mua sắm, chợ, đặc sản, thực phẩm, quà lưu niệm",6:00 - 18:00,Miễn phí,4.2
47,Chùa cổ Tuyền Lâm,"Ngôi chùa tọa lạc tại số 887 Hồng Bàng, luôn thu hút đông đảo du khách thập phương với không gian tôn nghiêm và cổ kính.",Chùa / Di tích lịch sử,Quận 6,"887 Hồng Bàng, Phường 9, Quận 6, TP.HCM","chùa cổ, tôn giáo, di tích, Phật giáo",6:00 - 18:00,Miễn phí,4.4
48,Chợ đồ cũ Nghĩa Hòa,"Chợ chuyên bán các mặt hàng thời trang cũ, hàng thùng với giá rẻ và chất lượng bất ngờ, là thiên đường cho tín đồ săn đồ second-hand.",Chợ đồ cũ,Quận Tân Bình,"Nghĩa Hòa, Phường 6, Quận Tân Bình, TP.HCM","đồ cũ, second-hand, thời trang giá rẻ",7:00 - 17:00,Miễn phí,4.1
49,Khu vui chơi Vietopia,"Khu vui chơi giáo dục cho trẻ em với hơn 70 ngành nghề mô phỏng để bé trải nghiệm như bác sĩ, phi công, đầu bếp, kỹ sư...",Khu vui chơi trẻ em,Quận 7,"02-04 Đường số 9, Tân Hưng, Quận 7, TP.HCM","trẻ em, vui chơi, mô phỏng nghề nghiệp, giải trí",8:30 - 17:00,180.000 - 280.000 VNĐ,4.3
50,Artinus 3D Gallery,Bảo tàng mỹ thuật 3D với nhiều khu vực theo chủ đề và hàng trăm tác phẩm tranh 3D đặc sắc giúp khách tham quan chụp ảnh độc đáo.,Bảo tàng / Nghệ thuật,Quận 7,"02-04 Đường số 9, KDC Him Lam, Quận 7, TP.HCM","bảo tàng, nghệ thuật, tranh 3D, chụp ảnh, giải trí",9:00 - 18:00,200.000 VNĐ (người lớn) / 150.000 VNĐ (trẻ em),4.5
51,SC Vivo City Saigon,"Tổ hợp vui chơi Quận 7 với các dịch vụ mua sắm, giải trí và rạp chiếu phim công nghệ cao như IMAX, 3D IMAX.",Trung tâm thương mại,Quận 7,"1058 Nguyễn Văn Linh, Tân Phong, Quận 7, TP.HCM","mua sắm, giải trí, phim, IMAX, 3D",9:00 - 22:00,Miễn phí (phí dịch vụ tính riêng),4.3
52,Quận 7 Crescent Mall,"Trung tâm thương mại hiện đại, sang trọng gần hồ Bán Nguyệt, nơi du khách có thể mua sắm và dạo chơi.",Trung tâm thương mại,Quận 7,"101 Tôn Dật Tiên, Tân Phú, Quận 7, TP.HCM","mua sắm, giải trí, trung tâm thương mại, sang trọng",10:00 - 22:00,Miễn phí,4.4
53,Jump Arena Him Lam,"Khu thể thao mạo hiểm trong nhà nổi bật với các trò chơi vận động như leo núi đá, ninja, parkour,...",Khu vui chơi thể thao,Quận 7,"02-04 Đường số 9, Him Lam, Quận 7, TP.HCM","thể thao, vận động, leo núi, nhảy, parkour, trẻ em",9:00 - 21:00,150.000 - 250.000 VNĐ,4.2
54,Big Fun,"Khu vui chơi trẻ em 750m2 với các trò chơi như Lego, Play-doh, giúp phát triển tư duy và thể chất.",Khu vui chơi trẻ em,Quận 7,"Lầu 2, SC VivoCity, 1058 Nguyễn Văn Linh, Quận 7, TP.HCM","trẻ em, học mà chơi, lego, tư duy, thể chất",9:00 - 21:00,80.000 - 150.000 VNĐ,4.1
