id,ten_dia_diem,mo_ta,loai_dia_diem,khu_vuc,dia_chi,tu_khoa,thoi_gian_hoat_dong,gia_ve,danh_gia
117,Khu du lịch Tân Cảng,"Khu du lịch ven sông Sài Gòn, thoáng mát, phù hợp tổ chức tiệc công ty hoặc họp mặt gia đình. Có view sông đẹp, nhà hàng phục vụ nhanh.",Khu du lịch - Nhà hàng ven sông,Bình Thạnh,"A100 Ung Văn Khiêm, Phường 25, Quận Bình Thạnh, TP.HCM","Tân Cảng, nhà hàng ven sông, họp mặt, du lịch, Bình Thạnh",8:00 - 22:00,Miễn phí vào cổng (dịch vụ tính phí),4.1
118,Khu du lịch Bình Quới 2,"Không gian thoáng, hồ sen, nhà chòi và khu ăn uống dân dã. Phù hợp đi cuối tuần cùng gia đình. Có phòng nghỉ nhưng gần ao nên có muỗi.",Khu du lịch sinh thái,Bình Thạnh,"1147 Bình Quới, Phường 28, Quận Bình Thạnh, TP.HCM","Bình Quới 2, hồ sen, phòng nghỉ, gia đình, thiên nhiên",7:00 - 21:00,"Miễn phí vào cổng, buffet 250.000 - 300.000 VNĐ/người",4
119,Khu du lịch Bình Quới 1,"Không gian đậm chất miền quê, cây xanh và hồ nước tạo nên phong cảnh thư giãn. Thích hợp tụ họp gia đình, nhóm bạn, đặc biệt có khu vui chơi trẻ em.",Khu du lịch sinh thái,Bình Thạnh,"1147 Bình Quới, Phường 28, Quận Bình Thạnh, TP.HCM","Bình Quới 1, họp mặt, buffet, cảnh quê, thiên nhiên",7:00 - 21:00,"Miễn phí vào cổng, buffet khoảng 250.000 VNĐ/người",4.2
120,Lăng Ông Bà Chiểu,"Di tích lịch sử thờ Tả Quân Lê Văn Duyệt, kiến trúc đậm chất cổ xưa Việt Nam. Không gian trang nghiêm, thích hợp tham quan, tìm hiểu văn hóa.",Di tích lịch sử - Văn hóa,Bình Thạnh,"1 Vũ Tùng, Phường 1, Quận Bình Thạnh, TP.HCM","Lăng Ông, Lê Văn Duyệt, di tích, văn hóa, chụp ảnh",7:00 - 17:00,Miễn phí,4.3
121,Chợ Bà Chiểu,"Chợ nổi tiếng ở quận Bình Thạnh với ẩm thực đa dạng, đồ si, giá cả bình dân. Không khí luôn náo nhiệt và đông đúc.",Chợ truyền thống,Bình Thạnh,"40 Diên Hồng, Phường 1, Quận Bình Thạnh, TP.HCM","chợ, Bà Chiểu, ẩm thực, đồ si, giá rẻ, đông đúc",5:00 - 20:00,Miễn phí,4
122,2PM Coffee,"Quán có decor dễ thương, nhiều góc sống ảo. Đồ uống ổn, không gian phù hợp để chụp hình và trò chuyện ngắn.",Quán cà phê,Phú Nhuận,"135/1 Nguyễn Văn Trỗi, Phường 11, Quận Phú Nhuận, TP.HCM","cafe, sống ảo, decor, 2PM, Phú Nhuận",8:00 - 22:00,30.000 - 60.000 VNĐ,4.1
123,Amhaus Home Café,"Quán cà phê tone trắng xanh dịu nhẹ, không gian yên tĩnh, có sách đọc. Phù hợp cho người đi cà phê một mình hoặc học tập.",Quán cà phê sách,Bình Thạnh,"45/9A Nguyễn Cửu Vân, Phường 17, Quận Bình Thạnh, TP.HCM","cafe sách, Amhaus, tone trắng xanh, yên tĩnh",8:00 - 21:00,35.000 - 65.000 VNĐ,4.3
124,JeJu Coffee,"Quán cà phê phong cách Hàn Quốc, tường kính và khu vườn xanh mát. Nhiều góc sống ảo nổi bật và ánh sáng tự nhiên.",Quán cà phê,Tân Bình,"54 Nguyễn Minh Hoàng, Phường 12, Quận Tân Bình, TP.HCM","cafe Hàn Quốc, Jeju, sống ảo, kính, cây xanh",7:00 - 22:00,40.000 - 70.000 VNĐ,4.4
125,Nhà hàng Phong Cua 2,"Nhà hàng chuyên hải sản, thực khách tự chọn hải sản sống để chế biến. Không gian thoáng mát, view sông đẹp nếu đặt bàn sớm.",Nhà hàng hải sản,Bình Thạnh,"1019B Bình Quới, Phường 28, Quận Bình Thạnh, TP.HCM","nhà hàng, hải sản, cua, Phong Cua, view sông",10:00 - 22:00,200.000 - 500.000 VNĐ/người,4.2
126,Quán Le Steak,"Không gian nhỏ, nên đặt bàn trước. Đồ ăn chất lượng, giá hợp lý. Steak mềm, ngon, nước sốt đậm đà. Phục vụ nhanh và thân thiện.",Nhà hàng bít tết,Tân Bình,"26 Trường Sơn, Quận Tân Bình, TP.HCM","steak, bít tết, nhà hàng, đồ Tây, Le Steak",10h00 - 22h00,100.000 - 250.000 VNĐ,4.5
127,Khu du lịch Bến Xưa,"Khu du lịch ven sông Vàm Thuật với không gian yên bình, cây xanh mát mẻ, kết hợp với các nhà hàng sang trọng, món ăn thuần Việt ngon miệng.",Khu du lịch,Quận 12,"39A Hà Huy Giáp, Thạnh Lộc, Quận 12, TP.Hồ Chí Minh","du lịch, nhà hàng, Bến Xưa, sông Vàm Thuật, Quận 12",07h00 - 21h00,328.000 đồng,4.3
128,Tu viện Khánh An,"Ngôi chùa lớn với kiến trúc Nhật Bản độc đáo, không gian yên tĩnh, mang lại sự an yên. Chất liệu chủ yếu là gỗ, nghệ thuật chạm khắc tinh xảo.",Chùa / Tu viện,Quận 12,"3D Quốc lộ 1A, Phường An Phú Đông, Quận 12, TP.HCM","chùa, tu viện, Khánh An, kiến trúc Nhật, yên tĩnh",05h00 - 21h00,Miễn phí,4.6
129,Làng cá sấu,"Không gian xanh mát, mô phỏng làng quê miền Tây. Có trại nuôi cá sấu, nhà hàng, tiệm lưu niệm, bán sản phẩm từ cá sấu.",Khu tham quan - trải nghiệm,Quận 12,"Đường Nguyễn Thị Sáu, Thạnh Lộc, Quận 12, TP.HCM","làng cá sấu, cá sấu, sản phẩm lưu niệm, miền Tây",08h00 - 20h00,Miễn phí,4.3
130,Khu tưởng niệm Vườn Cau Đỏ,"Khu tưởng niệm lịch sử kháng chiến, giáo dục truyền thống yêu nước cho thế hệ trẻ. Không gian trang nghiêm, yên tĩnh.",Di tích lịch sử,Quận 12,"12 Thạnh Xuân 52, Thạnh Xuân, Quận 12, TP.HCM","di tích, lịch sử, kháng chiến, Vườn Cau Đỏ, tưởng niệm",24h,Miễn phí,4.2
131,Moda House Coffee,"Quán cà phê phong cách vintage, tone nâu ấm áp, cực kỳ phù hợp để sống ảo, hẹn hò. Không gian ấm cúng và rất nhiều góc chụp đẹp.",Quán cà phê,Quận 12,"129 Thạnh Lộc 15, Quận 12, TP.HCM","cafe, vintage, sống ảo, Moda House, Quận 12",07h00 - 23h30,12.000 - 50.000 VNĐ,4
